<?xml version="1.0" encoding="UTF-8"?>
<devices xmlns:xsi="http://www.w3.org/2001/XMLSchema-instance" xsi:noNamespaceSchemaLocation="Devices.xsd">
  <cpu>
    <origin>USA</origin>
    <price>300.0</price>
    <energyConsumption>75</energyConsumption>
    <type>MAIN</type>
    <critical>true</critical>
    <clockRate>3.0</clockRate>
  </cpu>
  <datastorage>
    <origin>China</origin>
    <price>50</price>
    <energyConsumption>3</energyConsumption>
    <type>MEMORY</type>
    <critical>true</critical>
    <capacity>1000</capacity>
  </datastorage>
  <heatsink>
    <origin>China</origin>
    <price>30</price>
    <energyConsumption>2</energyConsumption>
    <type>MAIN</type>
    <critical>true</critical>
    <coolingType>Air</coolingType>
  </heatsink>
  <keyboard>
    <origin>China</origin>
    <price>100</price>
    <energyConsumption>2</energyConsumption>
    <type>PERIPHERAL</type>
    <critical>false</critical>
    <lights>true</lights>
  </keyboard>
  <motherboard>
    <origin>China</origin>
    <price>180</price>
    <energyConsumption>0</energyConsumption>
    <type>MAIN</type>
    <critical>true</critical>
    <formFactor>ATX</formFactor>
  </motherboard>
  <mouse>
    <origin>China</origin>
    <price>60</price>
    <energyConsumption>2</energyConsumption>
    <type>PERIPHERAL</type>
    <critical>false</critical>
    <numOfButtons>5</numOfButtons>
  </mouse>
  <powersupply>
    <origin>Japan</origin>
    <price>140</price>
    <energyConsumption>0</energyConsumption>
    <type>MAIN</type>
    <critical>true</critical>
    <powerRating>1000</powerRating>
  </powersupply>
  <ram>
    <origin>Japan</origin>
    <price>100</price>
    <energyConsumption>2</energyConsumption>
    <type>MEMORY</type>
    <critical>true</critical>
    <RAMType>DDR5</RAMType>
  </ram>
  <screen>
    <origin>Korea</origin>
    <price>200</price>
    <energyConsumption>40</energyConsumption>
    <type>PERIPHERAL</type>
    <critical>false</critical>
    <size>30</size>
  </screen>
  <speaker>
    <origin>Canada</origin>
    <price>200</price>
    <energyConsumption>60</energyConsumption>
    <type>PERIPHERAL</type>
    <critical>false</critical>
    <soundPower>110</soundPower>
  </speaker>
</devices>
